titulo;url;regiao;descricao
Arquiteto de Dados Sênior;https://www.catho.com.br/vagas/arquiteto-de-dados-senior/18249414/?origem_apply=busca-de-vagas&entrada_apply=direto;Campinas - SP (1);Suas principais responsabilidades serão: Buscamos candidato com experiência em arquitetura de dados no ambiente Cloud, especialmente na parte de BI e Analytics. Conhecimento de modelagem de dados. Conhecimento de rastreabilidade de dados e fluxo de ETL. Habilidade para entender o fluxo de dados para o negócio e transformar os requisitos identificados em solução. Habilidade para atuar como interface entre área de negócios e time de desenvolvimento (Engenheiros de Dados). Liderança de times. Conhecimento em gestão básica de projetos, a fim de organizar as atividades por prioridade e controlar demandas. Será o responsável pelo fluxo do processo, respondendo pela movimentação dos dados. Inglês fluente para interação com times globais. O que buscamos: Experiência em arquitetura de soluções end-to-end no ambiente Azure, especialmente na parte de BI e Analytics. Experiência em projetos Big Data no ambiente Azure, utilizando recursos Azure como HDInsight, Azure Databricks, Azure Synapse Analytics (antigo SQL DW), dentre outros. Conhecimentos de integração SAP. Conhecimento em arquitetura streaming. Certificação: Microsoft Certified: Azure Data Engineer Associate ou Microsoft Certified: Azure Solutions Architect Expert. Espanhol. Estar com passaporte e com visto americano dentro da validade (possibilidade de viagens para o Exterior). Informações adicionais: Disponibilidade para atuar em modelo remoto flexível.  Idioma:  Inglês - Fluente, Espanhol - Intermediário
Cientista de Dados;https://www.catho.com.br/vagas/cientista-de-dados/18539556/?origem_apply=busca-de-vagas&entrada_apply=direto;Brasilia - DF (1);Propor soluções técnicas para resolução de problemas complexos, fundamentado no estudo de dados. Reunir, analisar, comunicar, correlacionar, interpretar e transformar dados Aplicação de técnicas estatísticas e matemáticas como: Pareto, Histograma, Estudos de Amostras, Análise de padrões, Regressão linear e Logística, Anova, Frequência Absoluta e Relativa, Limites de Controle, distribuições e dispersões entre outras técnicas serão de relevantes.  Apoiar a implementação de novos projetos e produtos, auxiliar no estudo e desenvolvimento de Análises de Viabilidade técnica e de Custos. Atuar como responsável no mapeamento e identificação de disfunções em processos de produção, além de avaliar oportunidades de melhoria. Ensino Superior completo em Ciências da Computação, Engenharia, Engenharia de Dados, Estatística, Física ou Matemática. Pós-graduação Completa ou Cursando em: Big Data, Ciência de dados, Estatística aplicada a Saúde, Processos ou Produção. Proficiência em: Álgebra Linear, Matemática e Estatística aplicada.  Conhecimento no Pacote Office avançado .  Sólidos conhecimentos em: Data Mining, ETL e Estatística Aplicada em Saúde. Desejáveis Conhecimentos em: Banco de Dados, Big Data, Business Analitycs, Business Intelligence, fundamentos de linguagem de programação e construção de algoritmos, Data Lake, Data Warehouse, Deep Learning, Hadoop, Machine Learning, MapReduce e Spark, programação e análises de Dados (R,, Phyton e SQL). Experiência com ferramentas de análise e modelagem dados (Matlab, Minitab, e etc).  Idioma:  Inglês - Intermediário
Consultor Técnico Sênior;https://www.catho.com.br/vagas/consultor-tecnico-senior/18573626/?origem_apply=busca-de-vagas&entrada_apply=direto;Jaguariuna - SP (1);Projetos de implantação e operação de soluções de engenharia de dados com tecnologias Big Data Implantação de automações DevOps para provisionamento de artefatos e self- healing/autorrecuperarão de ambientes (infraestrutura como código) Operação de ferramentas de APM para monitoração de sistemas. Experiência em operações responsáveis por Site Reliability Engineering (SRE), através de disciplinas ITIL (solicitações/tickets, gestão de alertas, incidentes, problemas, configuração, mudanças). Conhecimentos Tecnologias Big Data (Hbase, Hive, ElasticSearch, Storm, Kafka e Zookeeper). Linguagens de programação para automação DevOps (Ansible, Chef, Rundeck, SCCM, Puppet, Satellite, PowerShell ? com Python, Java ou Ruby) Tecnologias de monitoração de sistemas (preferencialmente Dynatrace, mas interesse também por Interscope ou Zabbix) Ambientes de virtualização (ex: VMware, Hypervisor) Plataforma de computação em nuvem (ex: AWS, Google Cloud Platform, MS Azure) Inglês intermediário (leitura e escrita). Conhecimentos Desejáveis: Plataforma de decisões e scoring FICO Atuação em times através de gestão ágil (Ex: Scrum, SaFe). Atuação técnica no time de sustentação (Site Reliability Engineering) da mesa (área) responsável pela infraestrutura de motores das soluções Desenho e implantação de soluções de automação e configuração para mitigar riscos de indisponibilidade ou remediar problemas de infraestrutura e aplicações de diferentes tecnologias Buscar por oportunidades de evolução do ?manual? para o digital, através do AIOPS Instalação e configuração de ferramentas Troubleshooting e solução de problemas Apoio na definição e implantação de modelos de monitoração.
Analista de Dados;https://www.catho.com.br/vagas/analista-de-dados/18538752/?origem_apply=busca-de-vagas&entrada_apply=direto;Londrina - PR (1);Coletar a necessidade do negócio e criará um plano técnico para os desenvolvedores e, eventualmente, poderá participar de alguns desenvolvimentos também. Liderar e participar de sessões de design com administradores de dados corporativos e de hub, equipes de engenharia, cientistas de dados, gerentes de produtos, partes interessadas de negócios e de TI, que resultam em documentação para soluções de processamento, armazenamento e entrega de dados. Compreender as necessidades e processos de capacidade de negócios conforme se relacionam com Soluções de TI por meio de parceria com gerentes de produto e partes interessadas de negócios e funcionais de TI e aplicar esse conhecimento para influenciar as metas de negócios. Ajudar a equipe a estabelecer e melhorar processos e metodologias, como SCRUM ou Kanban, e/ou liderar novos pilotos Implementar soluções de dados de acordo com documentação de design usando uma variedade de ferramentas e linguagens de programação, como Kafka, bancos de dados SQL e não SQL, Scala, Go etc, e seguindo os processos e metodologias estabelecidos pela equipe. Facilitar e participar revisões de código, retrospectivas, testes funcionais e de integração e outros atividades da equipe focadas na melhoria da qualidade da entrega. Fornecer estimativas confiáveis ??para projeto de grande escala. Liderar a colaboração com proprietários de produtos, outros engenheiros e administradores de dados dentro da equipe e entre dados, plataformas técnicas e equipes de produtos no desenvolvimento e alinhamento de roteiros, datas de entrega e esforços de integração. Experiência com comercial e técnica em ferramentas AWS. Experiência com Diagrama de modelo de dados, documentação funcional e plano de teste. Desejável experiência com tecnologias AWS: EC2, Glue, Linux (Lambda), Spark, cNodes, Python e Espanhol
Analista de Dados;https://www.catho.com.br/vagas/analista-de-dados/18538744/?origem_apply=busca-de-vagas&entrada_apply=direto;São Paulo - SP (1);Coletar a necessidade do negócio e criará um plano técnico para os desenvolvedores e, eventualmente, poderá participar de alguns desenvolvimentos também.  Liderar e participar de sessões de design com administradores de dados corporativos e de hub, equipes de engenharia, cientistas de dados, gerentes de produtos, partes interessadas de negócios e de TI, que resultam em documentação para soluções de processamento, armazenamento e entrega de dados.  Compreender as necessidades e processos de capacidade de negócios conforme se relacionam com Soluções de TI por meio de parceria com gerentes de produto e partes interessadas de negócios e funcionais de TI e aplicar esse conhecimento para influenciar as metas de negócios.  Ajudar a equipe a estabelecer e melhorar processos e metodologias, como SCRUM ou Kanban, e/ou liderar novos pilotos  Implementar soluções de dados de acordo com documentação de design usando uma variedade de ferramentas e linguagens de programação, como Kafka, bancos de dados SQL e não SQL, Scala, Go etc, e seguindo os processos e metodologias estabelecidos pela equipe.  Facilitar e participar revisões de código, retrospectivas, testes funcionais e de integração e outros atividades da equipe focadas na melhoria da qualidade da entrega.  Fornecer estimativas confiáveis ??para projeto de grande escala.  Liderar a colaboração com proprietários de produtos, outros engenheiros e administradores de dados dentro da equipe e entre dados, plataformas técnicas e equipes de produtos no desenvolvimento e alinhamento de roteiros, datas de entrega e esforços de integração. Experiência com comercial e técnica em ferramentas AWS. Experiência com Diagrama de modelo de dados, documentação funcional e plano de teste. Desejável experiência com tecnologias AWS: EC2, Glue, Linux (Lambda), Spark, cNodes, Python e Espanhol.  Idioma:  Inglês - Fluente
Consultor de DataScience;https://www.catho.com.br/vagas/consultor-de-datascience/18512208/?origem_apply=busca-de-vagas&entrada_apply=direto;São Paulo - SP (1);Buscamos consultores em diversos níveis para projetos de Analytics e Machine Learning em instituições financeiras e grandes empresas de varejo. Formação em Estatística, Engenharia ou Ciência de de Dados. Experiência em desenvolvimento de modelos preditivos usando R, Python ou SAS.
Gerente de Growth;https://www.catho.com.br/vagas/gerente-de-growth/18474245/?origem_apply=busca-de-vagas&entrada_apply=direto;Barueri - SP (1);Experiência em marketing de Performance e Mobile apps. Definir quais dados e indicadores estratégicos são necessários para tomada de decisão. Definir as ferramentas para organização e análise dos dados. Criar soluções para uma melhor jornada do usuário. Melhorar o resultado em cada uma das etapas do funil de Growth. Construir e executar as melhores estratégias para aquisição e retenção de usuários através de mídia paga ou mesmo orgânico. Gestão de público alvo, criativos, budget e estratégias de leilão para maximizar a eficiência da mídia paga. Otimização de SEO e ASO para maior conversão de usuários. Dirigir decisões baseadas em dados através de contínuas experimentações e otimizações dos processos, inclusive testando novas interfaces. Trabalhar em conjunto com Produto, Engenheiros de software, Analista de dados e Designer para construção de funcionalidades que possibilitem escalabilidade do produto. Buscar e avaliar oportunidades de growth, priorizando os projetos de maior impacto e avaliando com os engenheiros e analista de dados, as dificuldades técnicas para o sucesso do projeto. Experiência com plataforma de atribuição ( Adjust). Habilidade em comunicação e persuasão para trabalhar com a sinergia entre os times disciplinares. Habilidade em análise de dados qualitativos e quantitativos para priorização de roadmap. Conhecimento em banco de dados (Mongo). Experiência com mobile. Inglês intermediário.
Analista de Suporte Técnico;https://www.catho.com.br/vagas/analista-de-suporte-tecnico/18474147/?origem_apply=busca-de-vagas&entrada_apply=direto;São Paulo - SP (1);Prestar suporte técnico presencial ou por telefone (Remoto) ao usuário, resolvendo problemas relativos ao funcionamento dos computadores da empresa. responsável por gerenciar as informações em uma organização, criando e distribuindo-as em redes de computadores, além de lidar com processamento de dados, engenharia de software, informática, hardwares e softwares. Desejável experiência na função. Formação concluída ou cursando, em Tecnologia da informação ou áreas afins!
Arquiteto;https://www.catho.com.br/vagas/arquiteto/18419461/?origem_apply=busca-de-vagas&entrada_apply=direto;São Paulo - SP (1);Desenvolvimento de projetos executivos e complementares Contato com fornecedores. Decisões técnicas Conhecimento em projetos executivos arquitetônico e disciplinas complementares (instalações e engenharias) Compatibilização Gestão de dados e documentos provenientes de tratativas com fornecedores. Desejável vivência com projetos fabril. Habilidade em: AutoCAD Project, Sketchup, Revit, BIM, Pacote Office.
Suporte Técnico;https://www.catho.com.br/vagas/suporte-tecnico/18408285/?origem_apply=busca-de-vagas&entrada_apply=direto;Fortaleza - CE (1);Prestar suporte técnico presencial ou por telefone (Remoto) ao usuário, resolvendo problemas relativos ao funcionamento dos computadores da empresa. responsável por gerenciar as informações em uma organização, criando e distribuindo-as em redes de computadores, além de lidar com processamento de dados, engenharia de software, informática, hardwares e softwares. Desejável experiência na função.  Formação concluída ou cursando, em Tecnologia da informação ou áreas afins!
Estágio em Análise de Dados;https://www.catho.com.br/vagas/estagio-em-analise-de-dados/18544218/?origem_apply=busca-de-vagas&entrada_apply=direto;Belo Horizonte - MG (1);Deverá estar cursando: Ensino Superior cursando em áreas de Tecnologia, Matemática, Estatística, Administrativa, Engenharias ou afins. Extração de dados do sistema. Alimentar e atualizar bases de dados. Atualização de dashboards no Power BI. Criação de tabelas, planilhas. Validação de dados. Operacionalizar estudos de caso. Ajudar em conferências de planilhas de outros departamentos. Conhecimento intermediário ou avançado em Excel (ou Planilha Google). Conhecimento básico de estatística. Conhecimento básico em Power BI.
Analista de Projetos;https://www.catho.com.br/vagas/analista-de-projetos/18534037/?origem_apply=busca-de-vagas&entrada_apply=direto;Nova Lima - MG (1);Editar e inserir informações no SAP, formatar e criar planilhas para carga em massa de informações no SAP, auxiliar as equipes de Manutenção, PCM e Engenharia no cadastro de dados, elaboração de relatórios semanais de acompanhamento. Graduação em Administração ou áreas correlatas Desejável experiência (na área): SAP - PM Conhecimento em Excel e Power Bi.
Tech Talentos RECODE;https://www.catho.com.br/vagas/tech-talentos-recode/18495179/?origem_apply=busca-de-vagas&entrada_apply=direto;Barueri - SP (1);Desenvolvimento de Produtos e Demandas Testes (QA) Infraestrutura e Segurança Engenharia e Ciência de Dados BI Analytics Inovação e Produtos E muito mais!! Com a gente, além de participar das Baratonas (o nosso Hackathon interno) você trabalhará com diversas Tecnologias, entre elas:  C# .Net .Net Core PHP Node.Js React React Native SQLServer PostgreSQL
Data Engineer Tech Lead;https://www.catho.com.br/vagas/data-engineer-tech-lead/18488105/?origem_apply=busca-de-vagas&entrada_apply=direto;São Paulo - SP (1);Responder pela gestão do time de Engenharia Dados Prover análise e migrações de estruturas de dados vindas de diversas fontes Suportar a construção e manutenção do ambiente de Data Lake Conduzir o mapeamento e documentação da informação estratégica em formato tabular, incluindo data sets para modelagem estatística e auxílio no provisionamento de Data Marts. Efetuar manutenções em códigos existentes, desenvolver novas funcionalidades e manter "vivo" o ambiente atual Ser o agente transformador da Cultura DevOps. Experiência de implementação de Banco de dados relacional (SQLServer, Athena, MySQL e PostgreSQL) e soluções Big Data (MongoDB, Spark). Conhecimento em modelagem de dados (relacional e não relacional) Conhecimento em tuning de queries (SQL) Experiência com ferramentas de ETL - extração, transformação e carregamento (AWS DMS, Glue, dbt, Airflow, Stitch, NiFi) Linguagens de programação: Python (bibliotecas Pandas, Arrow, scikit-learn, PySpark) e JavaScript Conhecimento em estratégias e ferramentas de gestão do ciclo de vida dos dados e replicação Provisionamento de dados através da construção de APIs utilizando Python Flask Experiência com ambientes e serviços de Cloud para suporte ao Data Lake. Conhecimentos de AWS e Google Cloud. Principais requisitos: AWS Lambda, ECS (Docker), EC2, VPC, cluster EMR, S3, EFS e SageMaker.   Você terá destaque se:  Tiver conhecimentos de técnicas de Machine Learning Conhecimento de ferramentas de visualização, como Power Bi Experiência prévia com ambientes de Data Warehouse. Liderança de Squad em processo Ágil.    Soft Skills  Forte desejo de auto-desenvolvimento e aprimoramento Abertura para feedback Adora trabalhar em equipe Proatividade, sempre se importar e se comportar como o dono dos entregáveis.
Arquiteto de Dados Sênior;https://www.catho.com.br/vagas/arquiteto-de-dados-senior/18587912/?origem_apply=busca-de-vagas&entrada_apply=direto;São Paulo - SP (1);Experiência com engenharia ou arquitetura de dados. Ter sido parte de uma equipe de desenvolvimento mais ampla, pareando com pessoas desenvolvedoras e, idealmente, analistas de negócios, pessoas engenheiras de infraestrutura e designers. Práticas ágeis como Scrum. Modelagem de dados relacional e multidimensional lógica e física, BI, Analytics e Big Data. Desenvolvimento, projetos e ambientes Big Data. Universo Hadoop, Python, Spark, Pyspark, Microsoft Azure, PowerBI, DAX, Azure Data Lake, Stream Analytics, Governança de dados e arquitetura de dados.
Orçamentista de Máquinas e Equipamentos;https://www.catho.com.br/vagas/orcamentista-de-maquinas-e-equipamentos/18595463/?origem_apply=busca-de-vagas&entrada_apply=direto;Pinhais - PR (1);Responsável por analisar e desenvolver orçamentos de projetos mecânicos e instalações. Desenvolvimento de novos componentes e dimensionamento de estruturas. Propor soluções com objetivo de redução de custos e aumento da taxa de conversão de negócios. Liberação de pedidos, melhorias em projetos. Interagir com a engenharia para levantamento de dados e esclarecimentos. Controlar prazo de documentação e seguir as normas de qualidade. Experiência com projetos mecânicos em AutoCad e Catia. Conhecimento de leitura e interpretação de desenhos técnicos. Conhecimento em pacote Office Boa administração do tempo. Raciocínio lógico e bom relacionamento interpessoal. Ensino Técnico cursando Mecânica ou Mecatrônica.
Técnico Especialista de Manutenção;https://www.catho.com.br/vagas/tecnico-especialista-de-manutencao/18434335/?origem_apply=busca-de-vagas&entrada_apply=direto;Belo Horizonte - MG (1);Garantir se a execução das atividades está sendo realizadas com qualidade Esse profissional terá um olhar matricial vinculado a garantia da qualidade dos processos verificar a necessidade de realização de treinamentos multiplicar conhecimentos garantir que as pessoas que pertençam a área estejam alinhadas aos objetivos da área Mapear processos, identificar oportunidade de melhorias Apoiar o Supervisor de manutenção tecnicamente na condução da equipe durante a realização das atividades, identificando oportunidades de capacitação e treinando a equipe Treinar os executantes de manutenção na consulta de manuais de manutenção, catálogos de peças e softwares de diagnóstico Scania e Mercedes Bens Participar das análises de falha e perfil de perdas junto à Engenharia sendo o responsável por levantar dados para análises de por garantir o cumprimento das ações destas análises Auditar o processo de execução de manutenção quanto ao cumprimento de procedimentos operacionais, planos de manutenção, instruções dos manuais dos fabricantes e quanto a qualidade das informações registradas sobre as manutenções executadas Elaborar instruções técnicas e procedimentos operacionais Desenvolver trabalhos e análises técnicas específicas com relatórios técnicos conforme demandados pelo Coordenador de Manutenção. Técnico em Mecânica completo. Experiência em Manutenção de caminhões de pequeno porte.
Especialista em Marketing Digital;https://www.catho.com.br/vagas/especialista-em-marketing-digital/18119929/?origem_apply=busca-de-vagas&entrada_apply=direto;São Paulo - SP (1);Acompanhar o desempenho das campanhas e acessos do site através das ferramentas de Web Analytics - Analisar constantemente o desempenho das visitas, conversão, vendas e campanhas de marketing - Analisar dados do site e a partir deles ter insights para melhoria constante - Elaborar relatórios de acessos e desempenho - Mensurar cohorts, life time value e payback de cada canal de marketing - Analisar a experiência do usuário no site - Mensurar a verba de marketing por canal, calculando projeção de ROI - Analisar constantemente as metas do site por canal, informando a área de marketing para cumprimento de metas - Criar alertas na ferramenta de Web Analytics para monitoramento de erros no site - Contribuição para análises preditivas e construção de modelos de atribuição. Superior Completo em Administração, Marketing, Engenharia, Gestão de Dados e Informações ou áreas afins - Inglês Avançado - Pacote Office Avançado - Sólido conhecimento em , Google Analytics, Google Tag Manager, Google Ads, Google Sheets e Plataformas de mídia, teste A/B - Certificação Necessária: Google Adwords . Desejáveis: - Conhecimento e experiência em Scrum/Desenvolvimento Ágil - Integrações com Salesforce - Conhecimentos sobre integrações diversas para a utilização de novas mídias e automatizações necessárias
Programador Delphi;https://www.catho.com.br/vagas/programador-delphi/18194617/?origem_apply=busca-de-vagas&entrada_apply=direto;Rio do Sul - SC (1);Desenvolver e executar a manutenção dos programas e softwares. Desenvolver os programas em conformidade com o padrão de interface, navegação e engenharia de processamento estabelecidas para atendimento da qualidade de toda a aplicação Corrigir as inconformidades ou inconsistências dos programas Melhorar as rotinas dos softwares Ensino superior completo em Ciências da Computação, Engenharia da Computação, Sistemas de Informação, ou em áreas correlatas Experiência na função será um diferencial Linguagem de Programação Delphi Lógica de Programação Desejável vivência em Banco de Dados, Sistema Operacional, Softwares Auxiliares, Modelagem de Dados, Engenharia de Processamento de Programas Inglês Técnico.
Técnico em Tecnologia da Informação;https://www.catho.com.br/vagas/tecnico-em-tecnologia-da-informacao/18493346/?origem_apply=busca-de-vagas&entrada_apply=direto;São Paulo - SP (1);gerenciar as informações em uma organização, criando e distribuindo-as em redes de computadores, além de lidar com processamento de dados, engenharia de software, informática, hardwares e softwares.  instalações ERP pró ativo, interessado dinâmico e ágil
Desenvolvedor Android | Presencial ou Home Office;https://www.catho.com.br/vagas/desenvolvedor-android-presencial-ou-home-office/18621214/?origem_apply=busca-de-vagas&entrada_apply=direto;São Paulo - SP (1);A Eleflow nasceu para tornar Big Data Analytics e Machine Learning mais acessíveis para as empresas. Com um time de Desenvolvedores, Engenheiros, Cientistas e Analistas de Dados experientes, motivados e curiosos buscamos ser os diferenciadores nos projetos que atuamos. Requisitos básicos:- Android Studio- Java- Kotlin.Requisitos desejáveis:- Graddle- Detekt- Mockito- OpenAPI- Ambiente AWS (Lambdas, API Gateway, SNS)
Técnico Informática;https://www.catho.com.br/vagas/tecnico-informatica/18612685/?origem_apply=busca-de-vagas&entrada_apply=direto;Belo Horizonte - MG (1);Gerenciar as informações em uma organização, criando e distribuindo-as em redes de computadores, além de lidar com processamento de dados, engenharia de software, informática, hardwares e softwares.    Configurações e programações de sistemas informáticos    Montagem e instalação de computadores    Assistência na correção de defeitos ou falhas nas redes ou equipamentos    Responsável pela cotação e compra de suprimentos para o setor. Necessário curso técnico de informática
Programador PHP;https://www.catho.com.br/vagas/programador-php/18395919/?origem_apply=busca-de-vagas&entrada_apply=direto;Rio do Sul - SC (1);Desenvolver os programas em conformidade com o padrão de interface, ergonomia, navegação e engenharia de processamento estabelecidas para atendimento da qualidade de toda a aplicação Corrigir as inconformidades ou inconsistências dos programas Ensino superior completo ou cursando Ciências da Computação, Engenharia da Computação, Sistemas de Informação ou em áreas correlatas. Linguagens de Programação PHP, Lógica de Programação. Desejável vivência em Banco de Dados, Sistema Operacional, Softwares Auxiliares, Modelagem de Dados, Engenharia de Processamento de Programas.
