titulo;url;regiao;descricao
Engenheiro de Dados Etl;https://www.catho.com.br/vagas/engenheiro-de-dados-etl/18646877/?origem_apply=busca-de-vagas&entrada_apply=direto;Brasilia - DF (1);Buscamos profissionais para atuação: Criação, versionamento e manutenção de workflows para consumo, carregamento e processamento de dados. Criação de scripts de ETL de dados ,Deploy de modelos preditivos e criação de estrutura para acompanhamento de métricas e testes A/B de modelos. Criação e manutenção de base de dados para análises e relatórios. Coletar, limpar, combinar e tratar dados de diferentes fontes. Criar e implementar processos automatizados de Data Quality. Integração com ferramentas de governança e gerenciamento de dados. Contribuir na definição da arquitetura de dados da organização. Apoiar na criação e manutenção em ambiente de big data utilizando práticas devops e dataops. Disseminação de boas práticas para o time de engenharia. Realizar reviews de código para garantir a qualidade de código e dos dados. Realizar estimativas e análises técnicas de estórias. Formação em Ciências da Computação, Engenharia da Computação, Sistemas de Informação, Análise e Desenvolvimento de Sistemas ou áreas correlatas Conhecimento avançado em Python ou e/ou Scala e/ou Java. Conhecimentos básicos em Linux. Experiência imprescindível na ferramenta: Spark. Desejável Experiência em outras ferramentas como Databricks. Conhecimentos básicos em AWS ou Azure. Conhecimento avançado em SQL. Conhecimento em banco de dados relacionais e não relacionais. Experiência com processamento de dados (Streaming e batch). Experiência com CDC - Change Data. Capture. Raciocínio lógico e pensamento analítico Noções de kubernetes e docker. Bons conhecimentos em arquitetura de big data Conhecimentos em construção de API. Conhecimentos em Git. Conhecimentos em web scrap.
Engenheiro de Dados Sênior;https://www.catho.com.br/vagas/engenheiro-de-dados-senior/18656987/?origem_apply=busca-de-vagas&entrada_apply=direto;São Paulo - SP (1);Você trabalhará em estreita colaboração com nossa equipe de desenvolvimento, bem como com outras áreas da empresa, para melhorar e apoiar nossa tomada de decisão de dados.  - Coleta, análise e interpretação dos dados  - Criar comparações estatísticas  - Geração de Relatórios e documentação do projeto/produto  - Busca/Pesquisa de novas ferramentas e/ou tecnologias do mercado  - Tratamento/extração e análise de dados para ingestão em clusters de Big Data e afins  - Executar apresentações para explorar e expor resultados obtidos  - Criar pipelines confiáveis Requisitos:  - Experiência com Bancos de dados SQL, relacionais (Postgres / RDS)  - Experiência com banco de dados não relacionais (MongoDB)  - Conhecimento em Ferramentas ETL e pipelines de dados  - Conhecimento em Ferramentas de visualização (Metabase, entre outras)  - Experiência em Limpeza e avaliação de dados.    Perfil profissional:  - Hands On, disposto a fazer diversas atividades da área  - Profissional multi skills e com a mente aberta para aprender novas tecnologias e ferramentas  - Profissionais proativos, dinâmicos(as), com disposição para aprender algo novo todos os dias  - Motivados(as) em fazer parte de um time que busca entregar resultados de forma simples, eficiente e sustentável  - Capacidade de gerenciar seu próprio tempo  - Iniciativa e capacidade de trabalhar de forma independente e em equipe  Idioma:  Inglês - Intermediário
Engenheiro de Dados;https://www.catho.com.br/vagas/engenheiro-de-dados/18447908/?origem_apply=busca-de-vagas&entrada_apply=direto;São Caetano do Sul - SP (1);Responsável por gerenciar, otimizar, supervisionar e monitorar a recuperação, armazenamento e distribuição de dados em toda a organização. Engenheiros de dados são membros vitais de qualquer equipe corporativa de análise de dados.
Engenheiro de Dados;https://www.catho.com.br/vagas/engenheiro-de-dados/18632099/?origem_apply=busca-de-vagas&entrada_apply=direto;São Paulo - SP (1);Bacharelado em MIS, CIS, Estatística, Negócios ou área relacionada. - Experiência profissional relevante. - Experiência trabalhando com a Hadoop ou outra plataforma de Grandes Dados e construindo soluções que agregam valor através da alavancagem de dados como um ativo. - Proficiência em AWS, Drone e GitHub. - Experiência na construção de dutos de dados em lote e streaming usando sqoop, Kafka, Spark. - Conhecimento básico de Hive e Neo4j. - Capacidade demonstrada para definir conceitos e padrões arquitetônicos e sua utilização criando capacidades de acesso a dados escaláveis e sustentáveis. - Experiência trabalhando em SQL Queries/Views e paradigmas NoSQL para estruturas de dados e gráficos. - Forte experiência em trabalhar e projetar CI/CD e sua automação. - Capacidade de pensar além dos frameworks EDW e ESB quando se trata de dados. - Experiência demonstrada trabalhando com desenvolvimento de software de ponta a ponta utilizando metodologia ágil/scrum. - Motivado pelo aprendizado e experimentação, especialmente com um grupo pequeno e ágil de colegas. - Conhecimento sobre como os dados podem criar valor para os negócios/domínio (através do ciclo de vida) e apetite para construir esta habilidade ao longo do tempo. - Fortes habilidades interpessoais, capacidade demonstrada para construir confiança e fortes relacionamentos. - Fortes habilidades de comunicação e apresentação. - Orientação para os resultados e capacidade de trabalhar em situações ambíguas onde as exigências não são claras, especificações não em detalhes, etc. - Forte força conceitual, pensamento estratégico, resolução de problemas, habilidades técnicas e analíticas. - Aplicação demonstrada de forte consciência do mercado e foco no cliente. - Capacidade de usar uma abordagem empreendedora para resolver problemas comerciais. - Capacidade de fazer perguntas de próximo nível, antecipando consultas comerciais e realizando análise de causa raiz.
Engenheiro de Dados Sênior;https://www.catho.com.br/vagas/engenheiro-de-dados-senior/18658870/?origem_apply=busca-de-vagas&entrada_apply=direto;Jaguariuna - SP (1);Tratamento de dados, BI, Data Service. Necessário experiência na função/área. Ensino Superior na função.
Engenheiro de Dados;https://www.catho.com.br/vagas/engenheiro-de-dados/18658128/?origem_apply=busca-de-vagas&entrada_apply=direto;São Paulo - SP (1);Projetar, modelar, documentar e implementar Data Warehouses com banco de dados Oracle Projetar, modelar, documentar e implementar um Data Lake Realizar ingestão de dados em batch, em streaming, carga de dados de diferentes fontes, organização e segurança dos dados e integração com outros repositórios de dados Auxiliar Cientistas e Analistas de Dados a analisar Big Data e oferecer soluções analíticas Criar Pipelines completo de análise de dados Participar da análise de demandas e levantamento de escopo assim como da execução de projetos Definir as atividades necessárias para a realização de projetos, analisando os impactos em sistemas e processos através do entendimento da necessidade, conhecimento técnico e arquitetônico dos sistemas Prestar consultoria e apoiar as áreas clientes e demais áreas de TI, proporcionando o esclarecimento de dúvidas relacionados ao projeto, contribuindo para uma melhor análise de impactos de processos e sistemas sob sua responsabilidade Participar e liderar as reuniões de planejamento e acompanhamento dos projetos Quando necessário executar atividades de desenvolvimento, execução e testes necessários para garantir a qualidade e performance da entrega Participar das atividades de planejamento para a liberação do produto para homologação e produção, por meio da validação de testes de aceite, assim como documentação de não conformidades avaliando e planejando a execução das correções reportadas. Experiência com Desenho e Implantação de soluções de BI e Analytics Experiência com ferramentas de ETL e integração de dados Experiência com Big Data e ecossistema Hadoop (Spark, Sqoop, MapReduce, etc). Experiência em métodos ágeis: Scrum e Kanban Experiência em liderança de projetos de Data Warehouses: Design e Implementação Experiência em integração de dados tradicional (ETL): IBM Data Stage 8.5 e 11.3 Experiência técnica Oracle 12g (modelagem e manipulação de dados) Experiência em Data Lakes: Kafka, SQOOP, Spark streaming, Hadoop Experiência desejada em Analytics, Visualização, Relatórios e Tomada de Decisões com BIG Data: Power BI ou Tableau.
ENGENHEIRO DE DADOS;https://www.catho.com.br/vagas/engenheiro-de-dados/18325080/?origem_apply=busca-de-vagas&entrada_apply=direto;Maringa - PR (1);Gosta de desafios ?A Gerando Falcões está inaugurando uma nova posição de ENGENHEIRO DE DADOS.Se você está pronto para colocar a mão na massa, e fazer acontecer, então essa vaga é perfeita para você!Vem com a gente, vem ser Falcão! Ensino Superior Completo em: Ciência da Computação, Engenharia da Computação ou áreas relacionadasInglês: BásicoDomínio em linguagem SQL e PythonDomínio em banco de dados: SQL Server, Oracle, MySQL e NoSQLDomínio em ingestão, integração. processamento e armazenamento de dadosConhecimento em ferramentas de ETL como Pentaho, SSIS, Data FactoryConhecimento em uso e desenvolvimento de API'SConhecimento em ferramentas de report e visualização de inteligência de dados (Power BI, DataStudio, Tableau).
Engenheiro de Dados;https://www.catho.com.br/vagas/engenheiro-de-dados/18651257/?origem_apply=busca-de-vagas&entrada_apply=direto;São Paulo - SP (1);Criar pipelines de leitura, transformação, carga e processamento de dados de fontes diversas (Oracle, SQL, text files, API&#39s JSON e XML) organizando os dados em data lake e ambiente data warehouse. Bancos de dados SQL, Comunicação web por Webservices e Web API&#39s, organização de Data Lakes e plataformas de big data Azure Data Lake, Python, Apache Airflow e Apache Spark.
Engenheiro de Dados;https://www.catho.com.br/vagas/engenheiro-de-dados/18650367/?origem_apply=busca-de-vagas&entrada_apply=direto;São Paulo - SP (1);Desenvolvimento de soluções com grandes volumes de dados, seja offline ou real time. Ajudar na expansão da Plataforma Analítica, com foco em Self Service Analytics e ferramental Big Data. Garantir a preparação dos dados. Criação de modelos e indicadores. Parear com times de negócios Construção e otimização de ETL. Conhecimentos avançados em SQL. Experiência com modelagem dimensional de dados reporting e dashsboards como: Power BI Elevantamento de requisitos. Experiência em pipelines streaming e batch. Linguagens de programação, como: Java, Python ou Scala. Conhecimentos em otimização de performance em processos Spar. Experiência com tecnologias como: Apache Airflow , Spark , Kafka, AWS Redshift , EMR, S3, Glue , Hive e Athena) Ferramentas de automação e provisionamento.
Engenheiro de Dados;https://www.catho.com.br/vagas/engenheiro-de-dados/18624463/?origem_apply=busca-de-vagas&entrada_apply=direto;Rio de Janeiro - RJ (1);Somos uma empresa do grupo América Móvil, com mais de 30 anos de experiência no mercado de soluções digitais e serviços de TI na América Latina e Estados Unidos. Desde 2010, nossas conquistas têm crescido e para sustentá-las, contamos com aproximadamente 3.000 profissionais engajados no desenvolvimento consistente do nosso negócio no País. Apostamos em talentos, no trabalho em equipe, na diversidade e em um ambiente inclusivo. Acreditamos no desenvolvimento de pessoas, no empoderamento como meio de superação de limites e promoção de resultados. Temos a bordo profissionais, programas jovem aprendiz, estágio e trainee. Apoiamos boas práticas e a sustentabilidade. Requisitos necessários: * Superior completo em Tecnologia da Informação, Engenharia da Computação, Ciência da Computação ou áreas correlata * Linguagens de Programação: Java, Python e SQL * Bancos de Dados NoSQL: Graph DB, Document DB (HBase ou Bigtable) * Google Cloud Plataform * Pub/sub, bigquery, dataflow Requisitos desejáveis: * Kubernetes e Janusgraph Princpais atribuições: * Construir, gerenciar e evoluir o pipeline * Definir arquitetura e soluções técnicas dos projetos * Coleta, combinação e disponibilização de dados * Configurar/desenvolver a ingestão de dados * Garantir a disponibilidade e performance da plataforma de dados * Implementar/gerir métodos de confidencialidade de dados * Disponibilização e integração de dados * Desenvolver estrutura de informações e dados Importante: Todas as nossas vagas são elegíveis para profissionais com deficiência, equidade de gênero e raça/ etnia.
Engenheiro de Dados (Inovação);https://www.catho.com.br/vagas/engenheiro-de-dados-inovacao/18383134/?origem_apply=busca-de-vagas&entrada_apply=direto;Porto Alegre - RS (1);Atuar no design, programação e testes de soluções críticas e escaláveis. Projetar, evoluir e manter pipelines de dados envolvendo as fases de ingestão, saneamento, processamento, entrega e visualização. Desenvolver e manter rotinas de captura, tratamento e enriquecimento de dados. Apoiar na análise dos dados processados pelas soluções e na preparação dos dados para exploração em ambiente analítico. Atuar na resolução de incidentes e defeitos, propondo melhorias para aplicações e processos. Apoiar na elaboração e revisão de especificações técnicas, funcionais e não funcionais. Trabalhar de forma colaborativa, apoiando o time e disseminando conhecimento. Conheça os conhecimentos que procuramos: Experiência prévia em desenvolvimento de sistemas corporativos e especificação de sistemas. Experiência prévia no desenvolvimento de pipelines de dados envolvendo as fases de ingestão, processamento, entrega e visualização. Computação em nuvem (preferencialmente Microsoft Azure) incluindo Storage, App Services, Serverless/Functions. Conhecimento em Ferramentas de Exploração e Análise de Dados, principais SGBDs de mercado, SQL, NoSQL, Spark, Python, etc. Boas práticas e metodologias de desenvolvimento de software. Perfil analítico e visão sistêmica. Iniciativa e pró-atividade para identificar, diagnosticar e propor soluções. Empatia e bom relacionamento para trabalho em equipe. Disposição e vontade para ensinar e aprender. Qualificações e Habilidades desejadas: Experiência em governança de dados incluindo saneamento, tratamento e classificação. Excel avançado para manipulação de dados. Ferramentas analíticas tais como Power BI, Microstrategy, Tableau, etc. Experiência com tecnologias envolvendo inteligência artificial e machine learning. Conhecimentos em HTML, XML, CSS, Maven/Ant, Log4j/Logback, JUnit/TestNG, WebServices SOAP/REST, JSF, Spring Boot, JPA com Hibernate, Angular 5, Javacript, TypeScript, Go Language. Formação Requerida: Superior completo na área de Tecnologia da Informação ou cursos afins.
Engenheiro de Dados Pleno;https://www.catho.com.br/vagas/engenheiro-de-dados-pleno/18383159/?origem_apply=busca-de-vagas&entrada_apply=direto;Porto Alegre - RS (1);Pesquisar, definir e desenvolver as soluções de processamento, armazenamento e disponibilização de grandes volumes de dados que compõem as plataformas Big Data, de dados e analítica, utilizadas pelos produtos da Neogrid. Construir e manter o pipeline de ingestão, processamento e transformação de dados em insights para os produtos dentro dos padrões de qualidade e performance, em cumprimento ao planejamento estabelecido. Experiência em desenvolvimento de sistemas corporativos, orientação a objetos, padrões de projetos e testes unitários. Experiência na tecnologia Scala ou Java, banco de dados relacional e NoSQL, gerenciamento de dependências (maven, sbt, gradle) e sistema operacional Linux. Conhecimento em arquitetura Big Data e experiencia nas tecnologias para processamento distribuído (Spark, MapReduce) Conhecimento em Hadoop e seu ecossistema (Hbase, HDFS, YARN, Zookeeper, Solr), e/ou conhecimento em processamento massivo de dados em cloud (Azure, AWS).Conhecimento em Business Intelligence (Datawarehouse, Datamining) Superior completo em Sistemas de Informação, Ciência da Computação, Engenharia da Computação, Análise de Sistemas ou área relacionada.
Engenheiro de Dados Pleno;https://www.catho.com.br/vagas/engenheiro-de-dados-pleno/18615333/?origem_apply=busca-de-vagas&entrada_apply=direto;São Paulo - SP (1);Nesta vaga de Eng. de Dados você irá trabalhar diretamente na construção e em melhorias de toda nossa infraestrutura de Dados, tanto para nossos times de BI quanto para nossos times de Engenharia de Dados. Será responsável por melhorias de processos e de ferramentas, construção e melhora de ETL&#39s, ferramentas de extração de dados, anonimização, padronização de dados. O QUE ESPERAMOS DE VOCÊ: Experiência comprovada na execução de pipeline de dados para Ciência de dados e Machine Learning. Ter a filosofia de que simplicidade é a maior das sofisticações. Trabalhe com software livre e seja um multiplicador deste conhecimento. Entender sobre arquitetura de dados moderna, ETL&#39s usando AIRFLOW ou correlatos. PONTOS EXTRAS PARA: Conhecimento em AWS, Amazon Web Service. Conhecimento em linguagens como Python e/ou Ruby. Ter implementado arquiteturas de extração e manipulação de dados usando Airflow+S3. BENEFÍCIOS DE UM NEXEER: Fazer parte do time que constitui a maior Fintech de Marketplace Lending da América Latina. Ambiente dinâmico, colaborativo e inovador: para conseguir acompanhar o mercado e continuar inovando, nosso ritmo é acelerado e nossa curva de aprendizado é muito alta. Além disso, valorizamos um ambiente informal com contato direto e constante com os sócios e o CEO. Honestidade e desenvolvimento: Aqui, você encontrará um ambiente que valoriza feedbacks 360° e 1:1. Acreditamos que a honestidade é a fórmula do desenvolvimento individual e do trabalho em equipe. Localização acessível: atualmente nosso escritório se encontra ao lado do metrô Faria Lima, com fácil acesso através de transporte público. Achamos essencial nosso escritório ser acessível e próximo a um dos maiores polos de comércio e finanças do país. Gympass: plataforma que te dá benefícios em mais de 18 mil academias no Brasil. Nas academias conveniadas são oferecidas mais de 700 modalidades esportivas, incluindo aulas de dança, artes marciais, musculação, yoga, aulas aquáticas, pilates e até massagem! POSHER Benefícios In-Company : plataforma que oferece uma diversidade de serviços online para aumentar o seu nível de bem-estar e ajudar você a relaxar! Você terá acesso a aulas online de yoga, pilates, mindfulness, consultas com nutricionistas e psicólogos, aulas de inglês, espanhol e muito mais. Tudo isso sem perder tempo com deslocamento! Plano de Saúde Unimed em parceria com a Vitta! Dando direito ao nosso colaborador ao PrimeCare: uma Equipe de Saúde 24/7, com tecnologia proprietária e time próprio, que pode ser acessada via WhatsApp ou pelo App. Ao ser atendido pelo médicos de plantão você terá direito de até 90% de subsídio no medicamento e reembolso de até R$220,00 por consulta Auxílio creche Cartão de Crédito Caju! Não quer gastar com comida!? Que tal usar seu VR para ir ao cinema ou à academia? O Cartão Caju dá a liberdade para o colaborador fazer o que quiser com o seu Vale Refeição. Vale Transporte
Engenheiro de Dados;https://www.catho.com.br/vagas/engenheiro-de-dados/18611945/?origem_apply=busca-de-vagas&entrada_apply=direto;Curitiba - PR (1);Desenhar e modelar novas soluções de arquitetura de dados seguras, confiáveis, disponíveis e escaláveis. Criar e definir modelagens de repositórios de dados de clientes tais como (Data Lakes, DataWareHouses, Bases relacionais e não relacionais). Desenvolver estratégias de aquisição de dados (históricos e online), recuperação de informação, implementação de pipelines de processamentos de dados e armazenamento de dados. Manter repositórios de dados seguros e pipelines de integração confiáveis e escaláveis. Planejar e modelar estruturas de comunicação de dados entre sistemas legados e repositórios de dados. Construir e sustentar a infraestrutura que suporta o treinamento e a operação de modelos de machine learning. Entendimento de necessidade de clientes junto à equipes de negócio. REQUISITOS E QUALIFICAÇÕES: Forte skill de engenharia de software Proficiência em alguma linguagem de programação. Preferência por Python ou Java Proficiência em linguagem SQL Conhecimento em big data, data warehousing, business intelligence Experiência em arquitetura e processos de cargas para DataLake Experiência em extrações de Dados via API&#39s Experiência com ferramentas de ETL Experiência com ferramentas de orquestração de fluxo de dados Conhecimento em DataOps e esteiras de CI/CD Experiência com cloud computing, preferencialmente GCP, AWS ou Azure. Diferenciais: Conhecimento em engenharia de machine learning Conhecimento em catálogo de dados.
Engenheiro de Dados Sênior;https://www.catho.com.br/vagas/engenheiro-de-dados-senior/18427584/?origem_apply=busca-de-vagas&entrada_apply=direto;São Paulo - SP (1);Irá atuar ativamente no desenvolvimento da plataforma de inteligência de dados de forma geral, desenvolver, evoluir e manter, como parte do escopo dos projetos. A plataforma está baseada em um ambiente AWS. Desenvolvimento e implementação de componentes AWS - EMR, Cloud Formation, Glue, Athena, APIs, Integration Services Administração de bucket S3 e instâncias AWS EC2 para execução de componentes da plataforma de Analytics quando requerido. Migração de dados a partir de fontes como SAP ECC e 4Hana, Sales Force, sistemas legados c/ bd no SQL Server, dados não estruturados como planilhas/imagens/etc e plataformas digitais (redes sociais, sites de e-commerce internos e externos, dados de apps entre outros) para nosso DataLake na AWS. Desenvolvimento de Lambda Functions, armazenamento em nosso DW, datamarts e cluster Big Data. Integração de dados utilizando como destino banco de dados SQL e NoSQL (Azure SQL DW, Aurora, MariaDb, Redshift, DynamoDb, MongoDb entre outros). Criação e manutenção de scripts em Python e SQL (conhecimentos em R e NodeJs desejáveis conhecimentos em Kafka e Kinesis serão considerados diferenciais). Experiência com modelagem de dados e especificação de arquitetura de soluções de BI & Analytics seguindo melhores práticas e/ou design patterns recomendados internamente ou por fornecedores.
Engenheiro de Dados;https://www.catho.com.br/vagas/engenheiro-de-dados/18616080/?origem_apply=busca-de-vagas&entrada_apply=direto;São Paulo - SP (1);Desenvolver soluções de engenharia de dados em nuvem utilizando os produtos Azure Databricks / Data Factory / Storage e Azure SQL Server Coletar requerimentos de usuários em relação as soluções de BI e Dados Construir modelagem que descrevam os dados e seus relacionamentos de modo consistente para suportar os objetivos de negócios tecnológicos Desenhar relatórios e dashboards que facilitem as atividades operacionais dos usuários de negócios e extrair insights avançados Definir e criar a camada semântica de dados Treinar e apoiar usuários na exploração autônoma dos dados usando as ferramentas apropriadas Definir processos que forneçam conjuntos de dados para análises, aumentando a velocidade das entregas Limpar e preparar dados para uso futuro (principalmente BigData) Simplificar o acesso e colaboração por meio de componentes reutilizáveis (APIs, Views, DataSet etc). Requisitos Necessários Conhecimentos em Azure Data Bricks / Azure Data Factory / Azure Storage / Azure SQL Arquitetura de ambientes de Dados utilizando Databricks / Data Factory / Storage e Azure SQL Server Análise de requisitos de dados e BI Modelagem e relacionamento de dados Desenhar e desenvolver relatórios e Dashboards Análise semântica de dados Executar o processo ETL Conhecimento de integração com fontes de dados Criação de processos para governança de dados. Requisitos Desejáveis Programação na Linguagem Python.
