titulo;url;regiao;descricao
Engenheiro de Dados Cloud - Pleno;https://www.catho.com.br/vagas/engenheiro-de-dados-cloud-pleno/18559946/?origem_apply=busca-de-vagas&entrada_apply=direto;São Paulo - SP (1);Engenheiro de dados, será responsável por criar novas ingestões usando componentes Google Cloud Plataform. Responsável por manutenções em ingestões e processos usando componentes Hadoop (Hortonworks).  Deverá desenvolver novas ingestões, transformações de dados com a automação do pipeline de implementação, monitoramento e testes de seu desenvolvimento.  Ficará alocado em squad ágil e seguirá o backlog de atividades dado pelo Product Owner da equpe. Hadoop (HDFS, Partionamento), Metodologia Ágil.                                                                       Vivência/experiência com modelo ágil de desenvolvimento de produto/software (ex: SCRUM, KANBAN, etc?)                                                                    Experiência relevante em pelo menos um dos abaixo: O Java, Python, Spark, Scala                                                                  Conhecimento em linguagem SQL Conhecimento em banco de dados relacional (ex: Oracle)                                                                     Conhecimento em criação de processos de carga de dados batch e streaming (origem e destino)                                                                      Conhecimento em bancos de dados NOSQL (ex: HBase, Elastic Search, MongoDB, Hive)                                                                         Experiência comprovada com cloud Google                                                                  Experiência com criação de pipelines de ingestão de dados usando Google Cloud                                                                    Desejável conhecimento de arquitetura de dados Big Data (Hadoop ou Google Cloud Platform) Desejável conhecimento na construção de Data Lakes e/ou Data Warehouses                                                                        Desejável conhecimento na construção de Dashboards                                                                       Desejável conhecimento em modelagem multidimensional                                                                     Inglês avançado/ técnico                                                                         Capacidade analítica                                                                     Visão Sistêmica                                                                  Postura de dono
Engenheiro de Dados Sr - Python;https://www.catho.com.br/vagas/engenheiro-de-dados-sr-python/18607954/?origem_apply=busca-de-vagas&entrada_apply=direto;São Paulo - SP (1);Resolução de problemas, boa compreensão da capacidade de sistemas, gargalos, noções básicas de memória, CPU, OS, armazenamento e redes. Compreensão de elementos de infraestrutura de maneira geral, como Rede, SO, Armazenamento, entre outros Python (diferenciais: Spark, Java, Scala, desenvolvimento de software, API, Apache Kafka, SDK e micro serviços) Manipular bases de dados tipo-SQL (diferenciais: HBase, Cassandra, Parquet, Avro) Desenvolvimento de ETL com Apache Beam. Excelente conhecimento em bancos de dados relacionais e não-relacionais. Bons conhecimentos em soluções de integração de dados (APIs, softwares, técnicas). Habilidade para entendimento do negócio do cliente, de forma a identificar relevância ou não nos dados manipulados. Habilidades de resolução de problemas, boa compreensão da capacidade de sistemas, gargalos, noções básicas de memória, CPU, OS, armazenamento e redes. Conhecimento em Linux..
Engenheiro de Dados Pl Sênior;https://www.catho.com.br/vagas/engenheiro-de-dados-pl-senior/18595657/?origem_apply=busca-de-vagas&entrada_apply=direto;São Paulo - SP (1);Banco de Dados (SQL, Postgre, MongoDB) e linguagem SQL, Python. Conhecimento avançado em SSIS, Dataflow, CloudStorage e PubSub, uso e desenvolvimento de API?s, análise e solução de problemas e transitar muito bem entre tecnologia e negócios. Superior completo em TI. Conhecimento em Modelagem de Dados e Integração de Dados. Desejável conhecimento com Progress.
Engenheiro de Dados Spark Sênior;https://www.catho.com.br/vagas/engenheiro-de-dados-spark-senior/18559841/?origem_apply=busca-de-vagas&entrada_apply=direto;São Paulo - SP (1);Realizar ingestão de Dados em Data Lake Hadoop através do Pyspark.                                                                                    Estruturar queries na origem (SQL) e no Data Lake.                                                                                       Realizar consumo em filas Kafka.                                                                                         Estruturar estratégia de ingestão, com o objetivo de viabilizar que o dado seja consumido da forma mais adequada pelo cliente, considerando data format, camadas no HDFS, processo para gravação no HDFS.                                                                                        Estruturar queries no Impala para que dados sejam consumidos em Dashboards que serão criados no PowerBI (Dashboards serão responsabilidade de outro time). Fundamentos de Big Data, Hadoop (HDFS, Partionamento), Hive, Impala, Kafka, Python, Shell Script, Spark, SQL, SQL em Hive e Impala. Vivência com Streaming será um diferencial.
Engenheiro de Dados Teradata Sênior;https://www.catho.com.br/vagas/engenheiro-de-dados-teradata-senior/18559868/?origem_apply=busca-de-vagas&entrada_apply=direto;São Paulo - SP (1);Desenvolvimento de rotinas nas linguagens atreladas a cada ambiente (Python, Spark, etc).                                                                      Desenvolvimento de Automações para Batimento, validações, etc, gerando alertas e insumos para ações de gestão de Recursos (Espaço, CPU, licença, etc), identificação de desvios, etc.                                                                    Desenvolvimento de monitorações/alertas para garantir a execução dos processos conforme schedule definido (Execução dentro do schedule e ANS esperado).                                                                          Analise, Definição, implantação e controle de Regras de Segurança (Permissionamento, etc).                                                                       Geração dos insumos (Bases, Logs, etc) para construção dos Painéis de Monitoração.                                                                       Otimização na passagem dos processos Produtivos para gestão do time de Sustentação.                                                                      Construção do Pareto dos Incidentes e Plano de Ação para correção em causa raiz dos Ofensores mapeados.                                                                          Construção de Base de Conhecimento para Incidentes, Erros conhecidos, Procedimentos Operacionais, etc.                                                                  Desenvolvimento técnico/Treinamento dos recursos internos. Teradata, Hadoop (HDFS, Partionamento), Hive, Python, Shell Script, Spark, SQL, SQL em Hive e Impala, Tableau.
Engenheiro de Dados Python - Sênior;https://www.catho.com.br/vagas/engenheiro-de-dados-python-senior/18560008/?origem_apply=busca-de-vagas&entrada_apply=direto;São Paulo - SP (1);Hive Python Spark Desejável - Streamsets - Rundeck (orquestrador de processos)
Engenheiro de Dados Azure Pleno;https://www.catho.com.br/vagas/engenheiro-de-dados-azure-pleno/18559914/?origem_apply=busca-de-vagas&entrada_apply=direto;São Paulo - SP (1);Atuar em uma das squads do projeto, cujo objetivo é implementação do ambiente cloud e data analytics. SQL Datafactory Conhecimento principal: SQL e que saiba lidar com cloud da Azure Databriks Plus, se tiver será ótimo: sinapse
Engenheiro de Dados Sênior - Alteryx;https://www.catho.com.br/vagas/engenheiro-de-dados-senior-alteryx/18515670/?origem_apply=busca-de-vagas&entrada_apply=direto;São Paulo - SP (1);Traduzir necessidades de negócios em requisitos técnicos. Projetar, desenvolver, implantar e oferecer suporte ao negócio através de desenvolvimento de soluções técnicas. Executar tarefas de manipulação/preparação de dados usando Alteryx, além de conhecimentos em consultas SQL/HQL. Compartilhar conhecimento e disseminar boas práticas para key-users e end-users. Ótima comunicação Autonomia Senso de urgência. Foco. Capacidade de sintetizar informações técnicas e de negócios para as partes interessadas individuais técnicas e não técnicas. Serão considerados Diferenciais: Certificações Alteryx.
Engenheiro de Dados (Big Data);https://www.catho.com.br/vagas/engenheiro-de-dados-big-data/18478149/?origem_apply=busca-de-vagas&entrada_apply=direto;João Pessoa - PB (1);Criar processos automatizados em Big Data, preparar e monitorar rotinas para reportes periódicos, garantir a ingestão e disponibilização de dados nos ambientes de BI, desenvolver políticas e procedimentos para a coleta e análise de dados, revisar e validar dados disponibilizados para o time de BI, interagindo com equipes multidisciplinares. Conhecimentos com: Big Data (SQL, Spark, Python, PySpark), Hadoop, Vivência em áreas de Analytics e Dados, Vivência na criação de indicadores de eficiência operacional e gestão de portfólio.
Engenheiro de Dados - Big Data;https://www.catho.com.br/vagas/engenheiro-de-dados-big-data/18478161/?origem_apply=busca-de-vagas&entrada_apply=direto;São Paulo - SP (1);Atuar com Splunk Enterprise, ingestões, criação de painéis, otimização de consultas, melhorias de performance, criação de comandos em python. Vivencia ambiente BigData (HDFS, Hive, Spark, HBase), Linux / Shell Script, Python, SQL. Diferencial: Certificação Splunk.
Desenvolvedor Engenheiro de Dados Sênior;https://www.catho.com.br/vagas/desenvolvedor-engenheiro-de-dados-senior/18474318/?origem_apply=busca-de-vagas&entrada_apply=direto;São Paulo - SP (1);Desenvolvimento alavancando framework Spark (ecossistema BigData).Desenvolvimento Java, Python e Scala em pipelines de integração de dados. Conhecimento de ambientes Cloud ? Azure preferencialmente. Experiência com pipeline DevOps ? Jenkins, SonarQube, Fortify.  Idioma:  Inglês - Fluente, Espanhol - Fluente
Engenheiro de Dados Bigdata Azure;https://www.catho.com.br/vagas/engenheiro-de-dados-bigdata-azure/18462859/?origem_apply=busca-de-vagas&entrada_apply=direto;São Paulo - SP (1);O que procuramos? Um profissional que seja apaixonado em transformar dados em informação e que atue com ingestão, integração e processamento de dados em Bigdata, em Databricks, Datafactory e Azure. O que você deve ter? Experiência em criação de pipeline Ingestão de dados. Atuação em implementação e evolução dos processos de ingestão e integração de dados. Experiência (Python, PySpark, Databricks, Datafactory, Azure)Experiência em HadoopExperiência em modelagem de dados.  O que mais seria interessante você saber? Conhecimento em metodologias ágeis Desejável conhecimento em criação de Dashboards em Power BI.
Engenheiro de Dados - Sênior | AWS;https://www.catho.com.br/vagas/engenheiro-de-dados-senior-aws/18167809/?origem_apply=busca-de-vagas&entrada_apply=direto;São Paulo - SP (1);Irá apoiar o time do cliente para otimizar os processos de ingestão atuais bem como desenvolver novos processos. Ambiente Linux AWS Git e GitFLow Python SQL.
Engenheiro de Dados - Sênior | GCP;https://www.catho.com.br/vagas/engenheiro-de-dados-senior-gcp/18438407/?origem_apply=busca-de-vagas&entrada_apply=direto;São Paulo - SP (1);O profissional atuará no desenvolvimento de app para programa de pontos e de fidelidade de um cliente varejista de grande porte. Entender as necessidades dos clientes, Desenvolver aplicações resilientes a falhas, Construções de documentações Técnicas (ex: Metadados e Catálogos de Dados), Arquitetar sistemas distribuídos, Criar pipelines de dados confiáveis, Combinar fontes de dados, Criar a arquitetura de soluções, Colaborar com a equipe de Data Science e construir as soluções certas para essas equipes. Fundamentos de Big Data, GCP, Hbase, NoSQL, Python, Scala, Spark, SQL. Desejável: Conhecimento de arquitetura de dados Big Data (Hadoop ou Google Cloud Platform) Conhecimento na construção de Data Lakes e/ou Data Warehouses Conhecimento em aplicação FRONT de Business Intelligence (ex: Tableau ou Power BI) Conhecimento na construção de Dashboards Conhecimento em modelagem multidimensional
Engenheiro de Dados - Sênior | Docker;https://www.catho.com.br/vagas/engenheiro-de-dados-senior-docker/18438391/?origem_apply=busca-de-vagas&entrada_apply=direto;São Paulo - SP (1);Será responsável por construir processos de ingestão utilizando PySpark e processos de ETL utilizando SQL. Ambiente Linux, Docker, Git e GitFLow, Python, Shell Script, Spark, SQL, SQL em Hive e Impala. Desejável conhecimento de access.
Engenheiro de Dados ETL Pleno;https://www.catho.com.br/vagas/engenheiro-de-dados-etl-pleno/18418666/?origem_apply=busca-de-vagas&entrada_apply=direto;São Paulo - SP (1);Requisitos Obrigatórios: Desenvolvimento ETL Pentaho Data Integration (PDI) Modelagem Dimensional de BI (Data Warehouse),  MongoDB. Requisitos Desejáveis: Amazon Redshift, Glue AWS Pyton Neo4j.
Engenheiro / Consultor de Dados;https://www.catho.com.br/vagas/engenheiro-consultor-de-dados/18550197/?origem_apply=busca-de-vagas&entrada_apply=direto;São Paulo - SP (1);Duas oportunidades para engenheiro/Consultor de Dados (Pleno e Sênior). Vivência em TI / Dados. Experiência em BIG DATA (Hadoop, ou Cloudera ou Hortonworks). Vivência com Hive. Vivência em HDFS. Vivência em shell Unix. Vivência em desenvolvimento Python ou Scala. Vivência em Spark. Desejável: Map Reuce, Zooeper, Ragner. CLT + Benefícios. Remoto.
Engenheiro - Arquiteto de Dados;https://www.catho.com.br/vagas/engenheiro-arquiteto-de-dados/18540490/?origem_apply=busca-de-vagas&entrada_apply=direto;São Paulo - SP (1);Prestar serviços de soluções tecnológicas. Avançados e prévia relevante com SOA Avançados e com design patterns de API&#39s e Micro serviços Cloud computing (AWS preferencialmente) Modelagem em banco de dados Relacionais e No-SQL Infraestrutura (Redes, Protocolos) CI/CD Kubernetes/Docker Inglês  Java SpringBoot, Flutter, Angular, ReactJS, Kafka.  Idioma:  Inglês - Fluente
Engenheiro de Dados Sênior (Lead Engineer);https://www.catho.com.br/vagas/engenheiro-de-dados-senior-lead-engineer/18456796/?origem_apply=busca-de-vagas&entrada_apply=direto;São Paulo - SP (1);Responsabiliza-se e garante a construção/desenvolvimento/implementação da solução técnica. Entendimento funcional do requisito de negócio e traduzir para fluxo de dados. Modelagem de dados em Hive/HBase. Implementação de fluxos de dados (pipelines) utilizando principalmente com Spark para distribuição e processamento paralelo. O destino de dados pode ser arquivos, API, ElasticSearch ou SFTP. Linguagem de programação com Scala. Implementação de fluxos de dados com arquitetura orientada a eventos (Apache Kafka), utilização de padronização de tipo de mensagem Avro/protobuf/json. Tecnologias: Git Jetbrains IntelliJ. Hadoop: YARN, HIVE. Apache HBase. Apache Spark. Apache Kafka. Protocolo Protobuf. Bash Shell Script.
Engenheiro de Dados PowerCenter + BDM Júnior;https://www.catho.com.br/vagas/engenheiro-de-dados-powercenter-plus-bdm-junior/18493229/?origem_apply=busca-de-vagas&entrada_apply=direto;São Paulo - SP (1);Atuar com processos de ETL e ferramentas de ETL (Power Center e BDM). Engenheiro de Dados com conhecimentos nas ferramentas Power Center e BDM.  Conhecimentos desejáveis: Banco de dados SQL Server e Framework Ágil.
Engenheiro de Dados / Cientista de Dados - Sênior - DataSUS;https://www.catho.com.br/vagas/engenheiro-de-dados-cientista-de-dados-senior-datasus/18270946/?origem_apply=busca-de-vagas&entrada_apply=direto;São Paulo - SP (1);Modelagem em ambiente Cloud levando em conta fonte de dados DataSUS Auxílio em definição de arquitetura de dados Cloud para suportar reports e integrações baseadas em DataSUS Suporte em integração de dados DataSUS com outras fontes de mercado e internas Qualificações Essenciais: Experiência em ramo Farmacêutico ou Saúde Experiência com modelagem de dados Experiência de trabalho com base DataSUS Conhecimento das regras existentes no acesso às informações DataSUS Soft Skills: Comunicativo Ownership Autodidata Hands-on Proatividade Linguagem de Programação (Java ou Python ou Scala) Experiência com Cloud (AWS, Azure ou GCP) Conhecimentos de ETL  Idioma:  Inglês - Fluente
Engenheiro de Dados BI Big Data;https://www.catho.com.br/vagas/engenheiro-de-dados-bi-big-data/18465512/?origem_apply=busca-de-vagas&entrada_apply=direto;Belo Horizonte - MG (3);Atuar em Engenharia de Dados com Projetos de Big Data em Nuvem. Experiência em projetos de Big Data. Conhecimentos em PYSPARK. Experiência com conjunto de ferramentas relacionadas a Big Data na AWS, como: Kafka, EMR, Kinesis, RedShift, S3, Glue, Athena, ElasticSearch. Conhecimentos em ferramentas de provisionamento de Infraestrutura em Cloud via código, tais como: Terraform, CloudFormation. Experiência com Bancos de Dados não Relacionais, como: HBase, DynamoDB, Cassandra ou MongoDB. Experiência prática com ingestão, integração, processamento e armazenamento de grandes volumes de dados. Conhecimento em linguagem Python, Java e/ou Scala. Experiências em ferramentas ETLs. Conhecimentos em modelagem de dados relacionais e dimensionais (Data WareHouse). Compreensão de Bancos de Dados Relacionais, como: SQL Server, PostgreSQL e MySQL. Experiência com tecnologias relacionadas ao ecossistema Hadoop, tais como: Hdfs, HBase, MapReduce, Spark, Hive. Conhecimentos em sistemas baseados no Unix.
Engenheiro de Dados Sênior Big Data;https://www.catho.com.br/vagas/engenheiro-de-dados-senior-big-data/18586279/?origem_apply=busca-de-vagas&entrada_apply=direto;São Paulo - SP (1);Sabemos que grandes resultados só são alcançados com uma grande equipe, por isso procuramos pessoas talentosas e apaixonadas, com desejo de crescer profissionalmente e criar uma trajetória de carreira conosco. Papéis e Responsabilidades: Engenheiro de dados para apoiar cliente com engenharia reversa e validação de dados em ambiente Big Data. Atuará tanto no desenvolvimento dos fluxo de carga, quanto na validação das regras de negócio e qualidade de dados. Qualificações Essenciais: Experiência em processos de ETL e ELT. Experiência com projetos Big Data e engenharia de dados Arquitetura Batch, Streaming, Lambda e Kappa. Conhecimento em plataformas Cloud. Experiência em Big Data. Ingestão e processamento de dados em DataLake e Data Warehouse.  Conhecimentos sólidos em Linux, conhecimentos em containers Docker (construção e publicação). SQL. Shell Script. Apache. Spark. Hadoop. Java ou Scala. Modelagem de dados em RDB e colunar. ELK (Elasticsearch, Logstash, Kibana). ETL (Ex.: Nifi, StreamSets, Logstash). GCP ou AWS. Construção de dashboards para análise (Grafana, Kibana, Power BI, Tableau) Certificação AWS, GCP e/ou Cloudera.
Engenheiro de Dados Sênior (Python + GCP);https://www.catho.com.br/vagas/engenheiro-de-dados-senior-python-plus-gcp/18493262/?origem_apply=busca-de-vagas&entrada_apply=direto;São Paulo - SP (1);Atuar com técnicas de captura, tratamento e estruturação de dados em arquitetura de processamento de dados com escalonamento horizontal (big data, cloud computing PaaS). Experiência atuando como Engenheiro de Dados Python com GCP. Operar sistemas operacionais linux (centos, RHEL):  Shell comandos básicos e intermediários. Edição de arquivos com VIM. Acesso remotto SSH. Outras operações baseadas em unix sem interface gráfica (GUI). Linguagem de programação: Python. Scala com spark. Arquitetura de big data e tecnologias de escalonamento horizontal: Conceitos de MPP. Cluster. Kubernetes. Devops:  git, jenkins, pipeline de deploy, Jira, Confluence. Integração de dados: Criar e manipular comandos DDL e DML. Fazer junções, agregações e ordenação de dados em tabelas utilizando. linquagem SQL ou tecnologias SPARK. Criar funções, classes e/ou métodos para processamento de fluxo de dados. em tecnologias de escalonamento horizontal. Google Cloud: Criar VMs, DataProc, Cloud Storage, Airflow. Conhecimentos desejáveis:  Boa comunicação e proatividade e aberto a conhecer novas tecnologias no cliente.
Engenheiro (a) de Dados | Presencial ou Home Office;https://www.catho.com.br/vagas/engenheiro-a-de-dados-presencial-ou-home-office/18621212/?origem_apply=busca-de-vagas&entrada_apply=direto;São Paulo - SP (1);A Eleflow nasceu para tornar Big Data Analytics e Machine Learning mais acessíveis para as empresas. Com um time de Desenvolvedores, Engenheiros, Cientistas e Analistas de Dados experientes, motivados e curiosos buscamos ser os diferenciadores nos projetos que atuamos. Requisitos principais:·&nbsp&nbsp&nbsp&nbsp&nbsp&nbsp&nbsp&nbspExperiência em processos de Extração, Padronização e Carga de dados (ETL), utilizando ferramentas ou linguagem de programação.·&nbsp&nbsp&nbsp&nbsp&nbsp&nbsp&nbsp&nbspConhecimentos e experiência nas melhores práticas em automação da carga de dados bem como de governança de dados.·&nbsp&nbsp&nbsp&nbsp&nbsp&nbsp&nbsp&nbspExperiência realizando análise de dados via SQL.·&nbsp&nbsp&nbsp&nbsp&nbsp&nbsp&nbsp&nbspExperiência com SQL, Java/Scala, Python, e Shell Script para automação·&nbsp&nbsp&nbsp&nbsp&nbsp&nbsp&nbsp&nbspLógica de programação e boas práticas de desenvolvimento·&nbsp&nbsp&nbsp&nbsp&nbsp&nbsp&nbsp&nbspExperiência em pelo menos um ambiente de Cloud: AWS, Azure, GCP ou IBM Cloud.·&nbsp&nbsp&nbsp&nbsp&nbsp&nbsp&nbsp&nbspExperiência com serviços Cloud (Azure ou similares): Azure Data Lake, Data Factory, Databricks.Requisitos Diferenciais: ·&nbsp&nbsp&nbsp&nbsp&nbsp&nbsp&nbsp&nbsp&nbspExperiência/Conhecimento em projetos de MDM ou criação de visão única de clientes. Conhecimentos em LGPD·&nbsp&nbsp&nbsp&nbsp&nbsp&nbsp&nbsp&nbspAzure Data Lake, Data Factory, Databricks.·&nbsp&nbsp&nbsp&nbsp&nbsp&nbsp&nbsp&nbspStory telling, organizado(a), senso de urgência e priorização de demandas.
Engenheiro de Dados Data Lake Sênior;https://www.catho.com.br/vagas/engenheiro-de-dados-data-lake-senior/18560343/?origem_apply=busca-de-vagas&entrada_apply=direto;São Paulo - SP (1);Hadoop (HDFS, Partionamento), Metodologia Ágil.                                                                       Vivência/experiência com modelo ágil de desenvolvimento de produto/software (ex: SCRUM, KANBAN, etc?)                                                                    Experiência relevante em pelo menos um dos abaixo: O Java, Python, Spark, Scala                                                                  Conhecimento em linguagem SQL Conhecimento em banco de dados relacional (ex: Oracle)                                                                     Conhecimento em criação de processos de carga de dados batch e streaming (origem e destino)                                                                      Conhecimento em bancos de dados NOSQL (ex: HBase, Elastic Search, MongoDB, Hive)                                                                         Experiência comprovada com cloud Google                                                                  Experiência com criação de pipelines de ingestão de dados usando Google Cloud                                                                    Desejável conhecimento de arquitetura de dados Big Data (Hadoop ou Google Cloud Platform) Desejável conhecimento na construção de Data Lakes e/ou Data Warehouses                                                                        Desejável conhecimento na construção de Dashboards                                                                       Desejável conhecimento em modelagem multidimensional                                                                     Inglês avançado/ técnico                                                                         Capacidade analítica                                                                     Visão Sistêmica                                                                  Postura de dono Teradata, Hadoop (HDFS, Partionamento), Hive, Python, Shell Script, Spark, SQL, SQL em Hive e Impala, Tableau.  ?Senso de urgência, Comunicação, Comprometimento.
Engenheiro de Dados Sênior - Power Center;https://www.catho.com.br/vagas/engenheiro-de-dados-senior-power-center/18249274/?origem_apply=busca-de-vagas&entrada_apply=direto;São Paulo - SP (1);Suas principais responsabilidades serão: Atuar na sustentação de sistemas utilizando a ferramenta Power Center. O que buscamos: Desenvolvimento e manutenção de mapas e workflows no Power center (Mapping Designer, Workflow Manager, Monitor). Conhecimentos em CTRL-M. Conhecimento em migração de objetos do Power center entre ambientes (Repository Manager). Conhecimento de queries em SQL (Oracle). Conhecimento básico de Shell Script. Conhecimentos desejáveis: Banco de dados Oracle, BDM e Framework Ágil/Scrum. Comportamentos Esperados: Bom relacionamento interpessoal. Organização e disciplina para o trabalho. Dinamismo e proatividade. Facilidade para o trabalho em equipe. Solução de problemas (busca de soluções).
