titulo;url;regiao;descricao
Engenheiro de Dados;https://www.catho.com.br/vagas/engenheiro-de-dados/18468637/?origem_apply=busca-de-vagas&entrada_apply=direto;São Paulo - SP (1);Responsável por criar novas ingestões usando componentes Google Cloud Plataform. Responsável por manutenções em ingestões e processos usando componentes Hadoop (Hortonworks). Deverá desenvolver novas ingestões, transformações de dados com a automação do pipeline de implantação, monitoramento e testes de seu desenvolvimento. Ficará alocado em squad ágil e seguirá o backlog de atividades dado pelo Porduct Owner da equpe. Vivência/experiência com modelo ágil de desenvolvimento de produto/software (ex: SCRUM, KANBAN, etc). Experiência relevante em pelo menos um dos abaixo: O Java, Python, Spark, Scala. Conhecimento em linguagem SQL. Conhecimento em banco de dados relacional (ex: Oracle). Conhecimento em criação de processos de carga de dados batch e streaming (origem e destino). Conhecimento em bancos de dados NOSQL (ex: HBase, Elastic Search, MongoDB, Hive). Experiência comprovada com cloud Google. Experiência com criação de pipelines de ingestão de dados usando Google Cloud. Desejável conhecimento de arquitetura de dados Big Data (Hadoop ou Google Cloud Platform). Desejável conhecimento na construção de Data Lakes e/ou Data Warehouses. Desejável conhecimento na construção de Dashboards. Desejável conhecimento em modelagem multidimensional . Inglês avançado/ técnico.  Idioma:  Inglês - Intermediário
Engenheiro de Dados;https://www.catho.com.br/vagas/engenheiro-de-dados/18472613/?origem_apply=busca-de-vagas&entrada_apply=direto;Avaré - SP (1);Propor, executar, validar, apresentar e implantar o uso de tecnologias e soluções para questões técnicas e também de negócios, através de ferramentas e arquiteturas projetadas para processamento de grande volume de dados, com foco em inovação, melhora na qualidade de dados e provendo insumos para novos produtos na empresa.
Engenheiro de Dados;https://www.catho.com.br/vagas/engenheiro-de-dados/18451185/?origem_apply=busca-de-vagas&entrada_apply=direto;São Paulo - SP (1);Experiência em Hortonworks Nifi, com conhecimentos em Java. Experiência em AWS Glue com Python e PySpark, rodando em EMR Cluster. Experiência em Java/Python (desejável para backend) Experiência com metodologia Ágil. Inglês Avançado. Experiência com ferramentas de integração como: Matillion / Informática Cloud. Experiência com bancos de dados cloud como: Snowflake / AWS Redshift. Experiência com tecnologias como: AWS S3, Google Cloud Storage, Azure Data Lake Storage. Conhecimentos avançados em SQL. Construção e otimização de ETL. Experiência em pipelines streaming e batch Experiência com levantamento de requisitos.  Idioma:  Inglês - Fluente
Engenheiro de Dados;https://www.catho.com.br/vagas/engenheiro-de-dados/18246328/?origem_apply=busca-de-vagas&entrada_apply=direto;São Paulo - SP (1);Atuar dentro do time de dados, traduzindo as demandas externas em produtos de dados Criar processos de ETL para alimentar o Data Lake e Data Warehouse Identificar e implementar a coleta de novas fontes internas e externas de dados Auxiliar a criação, manutenção e monitoramento do pipeline de dados Manutenção e evolução da modelagem de dados. Conhecimento em Cloud ( AWS ou GCP ) Experiência com SQL Experiência com bancos de dados Experiência com modelagem de dados Experiência com desenvolvimento em Python ou Java Vivência em implementação utilizando Big Data e Analytics Spark Conhecimento em metodologias ágeis Git Requisitos diferenciais: Sistemas de mensageria (Kafka/ Pub Sub / Kinesis) Experiência com Docker Conhecimento em ferramentas de orquestração (Airflow/Step Functions/Nifi) Experiência com sistemas distribuídos
Engenheiro de Dados;https://www.catho.com.br/vagas/engenheiro-de-dados/18467379/?origem_apply=busca-de-vagas&entrada_apply=direto;São Paulo - SP (1);- Processamento e gestão de dados  - Inspeção de dados  - Limpeza de dados  - Trasnformação de dados  - Modelagem de dados  - Adequação dos dados para atender as regras de negócios  - Criação de Data Marts para as diversas áreas da empresa (BI, Financeiro, Comercial, Operacional)  - Automatização do envio de dados para os clientes - Banco de dados SQL (relacional)  - Banco de dados NoSQL (NÃO relacional)  - MongoDB  - Data Mart  - Modelagem Dimensional  - Modelagem Transacional  - ETL  - TypeScript  - Node.js
Engenheiro de Dados;https://www.catho.com.br/vagas/engenheiro-de-dados/18451033/?origem_apply=busca-de-vagas&entrada_apply=direto;São Paulo - SP (4);Experiência com Python, AZURE, SAS Guide, Programação SAS avançada, aplicações do ecossistema Hadoop como (Hive, MapReduce, Storm, Flume, etc.) e Java Vivência em gerenciadores de Banco de Dados Oracle, SQL Experiência em Squads e Metodologia Ágil Atuação remota durante a pandemia, após este período, atuação híbrida em São Paulo (região da Faria Lima).
Engenheiro de Dados;https://www.catho.com.br/vagas/engenheiro-de-dados/18462627/?origem_apply=busca-de-vagas&entrada_apply=direto;Rio de Janeiro - RJ (1);Criação dos bancos de dados, migração de bases de dados e efetuar processos de ingestão. Conhecer Apache Beam ou Spark, linguagem Scala. Tecnologias: SQL Server, Redis, NiFi e Kafka (legado - Ghawk), Google Cloud SQL (MYSQL), Google bigQuery Google DataFlow, Google Pub/Sub e ElasticSearch.
Engenheiro de Dados;https://www.catho.com.br/vagas/engenheiro-de-dados/18451071/?origem_apply=busca-de-vagas&entrada_apply=direto;São Paulo - SP (2);Experiência em análise e desenho de processos Experiência em AZURE, SAS Guide, Programação SAS avançada, aplicações do ecossistema Hadoop como (Hive, MapReduce, Storm, Flume), Python e Java Vivência em gerenciadores de Banco de Dados Oracle, SQL Experiência em Squads e Metodologia Ágil Vivência com banco de dados relacionais e linguagem SQL (SQL Server e Oracle) Conhecimento em soluções de exploração de dados (Power BI, Tableau, SAS VA, outros) Noções de Analytics Experiência no segmento de varejo / e-commerce Conhecimento de soluções de exploração de dados (Power BI, Tableu, SAS VA, outros) Noções de analytics. Planejamento e alinhamento dos requisitos funcionais e artefatos a serem entregues a cada solicitação de demanda. Interagir com os clientes desde o levantamento de requisitos até a apresentação do relatório final. Habilidades de gestão técnica do time. Planejar, priorizar, orientar e acompanhar.
Engenheiro(a) de dados;https://www.catho.com.br/vagas/engenheiroa-de-dados/18461858/?origem_apply=busca-de-vagas&entrada_apply=direto;Jaguariuna - SP (1);DESCRIÇÃO DA VAGA Nós acreditamos que a tecnologia revoluciona verdadeiramente quando ela é capaz de mudar hábitos, facilitando a vida das pessoas.  Você vai trabalhar com um time multidisciplinar, com diferentes skills com o mesmo objetivo: Entregar a melhor experiência para seus usuários e clientes.    Você fará parte de um time, com interesse único de entregar tudo o que está por trás do negócio, sua escalabilidade e seu crescimento contínuo.  RESPONSABILIDADES E ATRIBUIÇÕES Você vai trabalhar com um time multidisciplinar, com diferentes skills com o mesmo objetivo: Entregar a melhor experiência para seus usuários.    Você fará parte de um time, com interesse único de entregar tudo o que está por trás do negócio, sua escalabilidade e seu crescimento contínuo. Se você tem paixão por trabalhar com dados que terá impacto na vida dos clientes, então você achou a sua oportunidade perfeita!    -Construção/consolidação e automação de dados  -Construção de dashboards em Power Bi REQUISITOS E QUALIFICAÇÕES Python Paixão por engenharia de alta qualidade SQL / NoSQL databases Automação de dados RPA Azure Graduação em Computer Science/Engineering Data modeling
Engenheiro de Dados;https://www.catho.com.br/vagas/engenheiro-de-dados/18462792/?origem_apply=busca-de-vagas&entrada_apply=direto;São Paulo - SP (1);Atuar na arquitetura de dados assim como em Hadoop, HDFS, Hive, Python, Scala, Shell script e SQL. Desejável vivência em ambientes cloud e metodologias ágeis.
Engenheiro de Dados;https://www.catho.com.br/vagas/engenheiro-de-dados/18462780/?origem_apply=busca-de-vagas&entrada_apply=direto;Recife - PE (1);Atuar na arquitetura de dados assim como em Hadoop, HDFS, Hive, Python, Scala, Shell script e SQL. Desejável vivência em ambientes cloud e metodologias ágeis.
Engenheiro de Dados;https://www.catho.com.br/vagas/engenheiro-de-dados/18455383/?origem_apply=busca-de-vagas&entrada_apply=direto;São Paulo - SP (1);Analisar, descrever, especificar, desenvolver, alterar, validar, implantar e manter os fluxos de dados, serviços e micro serviços, visando a ampla utilização da informação para integração de sistemas. Trabalhar junto aos arquitetos de dados e analistas de sistemas dentro de uma metodologia ágil, provendo o pipeline para extração, transformação de carga de dados estruturados com fontes diversas e heterogêneas, realizando tratamentos automatizados para garantir a qualidade e veracidade da informação. Vivência em liderança de SQUAD. Banco de Dados (SQL-Server, PostgreSQL, MongoDB), ETL (SSIS) e Modelagem Dados (SQL, SSAS, NoSQL), Foco em Java e ETL de SQL, não precisa Big Data (Hadoop, Spark...) nem IA/Ciência de Dados (Python, R, Machine Learning...)   Idioma:  Inglês - Intermediário
Engenheiro de Dados;https://www.catho.com.br/vagas/engenheiro-de-dados/18429162/?origem_apply=busca-de-vagas&entrada_apply=direto;São Paulo - SP (1);Implementação de infraestrutura e arquitetura de dados necessária para que o Cientista de Dados e a empresa possa fazer o uso adequado dos seus dados e transformando-os em informação, novos negócios e receita. Experiência em atuar de mãos dadas com o Cientista de Dados, sempre alinhados e com apoio das demais equipes da empresa. Responsável por planejar e desenvolver a arquitetura de dados, mantê-la atualizada e torná- la escalável. Ensino Superior completo em Ciências da Computação, Análise de Sistemas e Sistemas de Informação ou cursos correlatos Inglês. Conhecimentos avançados e práticos com bancos de dados SQL, PostgreSQL, TimescaleDB@PostgreSQL e MongoDB Conhecimentos avançados e práticos com API - Request/Response e em plataforma Microsoft Azure (Cloud) Databricks, DataFactory e Synapse Experiência em desenvolver, construir, testar e manter a arquitetura de dados Alinhar arquitetura de dados com requisitos de negócios Utilizar linguagem de programação e ferramentas adequadas para ingestão de dados e modelagem de dados Identificar maneiras de melhorar a confiabilidade, a eficiência e a qualidade dos dados Preparar dados para modelagem preditiva e prescritiva Entregar atualizações dos dados ao Cientista de Dados para que possibilite realizar as análises necessárias Conhecimentos básicos sobre Arquitetura de Soluções, intermediário sobre Arquitetura de Sistemas Distribuídos.
Engenheiro de Dados;https://www.catho.com.br/vagas/engenheiro-de-dados/18432774/?origem_apply=busca-de-vagas&entrada_apply=direto;Jaguariuna - SP (1);Construção/consolidação e automação de dados.  Construção de dashboards em Power BI. Python, Paixão por engenharia de alta qualidade, SQL / NoSQL databases, Automação de dados RPA, Azure, Graduação em Computer Science/Engineering, Data modeling.
Engenheiro de Dados;https://www.catho.com.br/vagas/engenheiro-de-dados/18413963/?origem_apply=busca-de-vagas&entrada_apply=direto;São Paulo - SP (2);Atuar com Mining e Big Data (Extração de dados, expertise em job SQL Server e automatizações de processos), procedures e functions em SQL, criação de dashboards usando Tableau, Power BI ou ferramentas similares. Implementação em ambiente cloud (Azure, AWS, etc), desenvolvimento de algoritmos para aplicação em larga escala, desenvolvimento de modelos de ML/ Modelagem Preditiva, dados não estruturados. PHD ou Mestrado em Ciências de Dados, Computação, matemática, física, estatística ou afins. Conhecimentos em Python ou R. Capacidade de comunicação e apresentação verbal e escrita, capacidade de transmitir conceitos matemáticos a não-peritos, conhecimentos em arquitetura de dados (experiencia como DBA).
Engenheiro de Dados;https://www.catho.com.br/vagas/engenheiro-de-dados/18413051/?origem_apply=busca-de-vagas&entrada_apply=direto;Barueri - SP (1);Implementar soluções de extração de dados.  Monitoramento do ambiente mantendo a infraestrutura de execução  Liderar novas propostas tecnológicas para evolução da plataforma e melhoria dos processos.  Gerenciar o volume, variedade, velocidade e veracidade dos dados no Data Lake  Monitorar e assegurar a execução dos pipelines de extração de dados  Acompanhar a resolução dos problemas quando encontrados.  Trabalhar em conjunto com equipes de: negócios, governança  Garantir que as soluções sejam escaláveis, com baixa latência e resiliência. Conhecimento em ETL, Unix  Conhecimento em processamento de dados em larga escala, processamento paralelo e distribuído  Linguagens de programação Python, Java ou Scala  Conhecimento em banco de dados NoSQL, SQL e Chave-valor  Computação em nuvem como Azure/Google Clouds  Datafactory, Databricks, Datalake, Utilização de serviços serverless  Processamento de dados em Batch e Streaming  Práticas de DevOps e infraestrutura como código  Conhecimento para desenvolver e gerenciar a Plataforma de Dados garantindo a sua aderência às necessidades tecnológicas e de negócios  Conhecimento em tecnologias de Big Data incluindo Hadoop, Spark, NiFi, Flume, Sqoop, Airflow, Kafka e hbase.
Engenheiro de Dados;https://www.catho.com.br/vagas/engenheiro-de-dados/18413277/?origem_apply=busca-de-vagas&entrada_apply=direto;Belo Horizonte - MG (1);Criação dos bancos de dados, migração de bases de dados e efetuar processos de ingestão. Ensino Superior. Experiência na linguagem NodeJs, experiência nas ferramentas de Dados da AWS, experiência em trabalhar com ETLs, experiência em tecnologias Datalake / Datawarehouse / Datamarts, experiência em tecnologias de streaming de dados (Kinesis / Kafka) Experiência em SQL. Será um diferencial se você tiver: Experiência avançada na linguagem NodeJs, experiência em trabalhar com CDC (Change Data Capture).  Idioma:  Inglês - Intermediário
Engenheiro de Dados Azure;https://www.catho.com.br/vagas/engenheiro-de-dados-azure/18595881/?origem_apply=busca-de-vagas&entrada_apply=direto;Brasilia - DF (1);4 anos de experiência como engenheiro de dados Experiência com o banco de dados Azure Com certificação em DP-200 e DP-201 OU DP-203. ?Experiência de 04 anos como engenheiro de dados ?Experiência com o banco de dados Azure ?Com certificação em DP-200 e DP-201 OU DP-203 Faixa Salarial ? Remuneração: 13.000,00 PJ ou CLT (+ Benefícios) Interessados encaminhar currículo para: rh5.vagastecnologia@gmail.com com o título: Engenheiro de Dados Azure
Engenheiro de Dados Sênior;https://www.catho.com.br/vagas/engenheiro-de-dados-senior/18512760/?origem_apply=busca-de-vagas&entrada_apply=direto;São Paulo - SP (1);O profissional estará encarregado de contribuir para o projeto de implementação de Sistemas escaláveis de ETL e processamento de dados para entrar em nosso ecossistema de Big Data. Construir e escalar a plataforma de análise interna, relatórios e decisões internas. Juntamente com o arquiteto de engenharia e infraestrutura, desenvolver melhorias na estratégia de dados, qualidade e governança. Colaborar com os arquitetos, proprietários de produtos, cientistas de dados e engenheiros de teste para ajudar a trazer projetos de R&D de Ciência de Dados para a produção. Gerenciar a infraestrutura de dados, para crescer e apoiar a equipe de Ciência e Engenharia de Dados, em relação à construção de produtos de dados performantes. Estabelecer a direção técnica para a equipe, impulsionando as mudanças necessárias e fazendo escolhas tecnológicas adequadas. Requisitos: AWS Python Terraform, Docker e Kubernetes Data Warehouse/Data Lake e ETL Spark, Spark Streaming, Hive, Storm, Sqoop, Kafka, Hbase e/ou HDFS SQL/NoSQL Métodos ágeis Disponibilidade para viagens, pois irá atuar com o time técnico de São Francisco e Singapura e eventualmente será necessário viajar para outras unidades Inglês avançado/fluente, diferencial para espanhol Curso superior na área de tecnologia/ exatas. Experiência com: Engenharia de Dados com serviços AWS Codificação de nível de produção em Python Projetos de arquiteturas de Data Warehouse/Data Lake e ETL com tecnologias de Big data como Spark, Spark Streaming, Hive, Storm, Sqoop, Kafka, Hbase e HDFS. SQL/NoSQL como MongoDB, Cassandra, Solr, Elasticsearch, Redshift, DynamoDB Processos Ágeis e Scrum.
Engenheiro de Dados - Scala;https://www.catho.com.br/vagas/engenheiro-de-dados-scala/18595882/?origem_apply=busca-de-vagas&entrada_apply=direto;São Paulo - SP (2);Isso mesmo estamos com a vaga que você tanto procurava Engenheiro de Dados - Scala. 100% Remoto com Auxílio Home Office. R$ 10.000,00 CLT + Benefícios (VA, VT, Plano de Saúde, Gympass). Requisitos -Experiência Linguagem Scala -Framework de processamento distribuído Scala - Spark Hadoop -Big Data -Conhecimento básico em Java. Desejável -Conhecimento em Cloud Azure.
Engenheiro de Dados Azure;https://www.catho.com.br/vagas/engenheiro-de-dados-azure/18249333/?origem_apply=busca-de-vagas&entrada_apply=direto;Campinas - SP (1);Suas principais responsabilidades serão: Engenheiro de Dados Sênior com experiência em processos de ingestão de dados, para atuar em processo de ingestão de dados baseado em PySpark (Databricks) e Azure Data Factory como orquestrador dos pipelines. Será o responsável pelo desenvolvimento e manutenção do fluxo da carga e garantia da qualidade dos dados. O que buscamos: Databricks Pyspark Azure Data Factory Azure Data Lakes (Storage Account Gen2). Processos ETL em Data Lake Conceitos das camadas bronze, silver e gold de um Data Lake. Inglês Fluente. Conhecimentos desejáveis: Já ter atuado em projetos com times globais.  Idioma:  Inglês - Fluente
Engenheiro de Dados Pleno;https://www.catho.com.br/vagas/engenheiro-de-dados-pleno/18607930/?origem_apply=busca-de-vagas&entrada_apply=direto;Osasco - SP (1);Construir e customizar pipeline de dados batch e realtime. Programar e dar manutenção em códigos escritos em R, Python e/ou Java. Definir e construir banco de dados relacionais com arquitetura distribuída para processamento de Big Data. Extrair, transformar e carregar (ETL) dados de um banco de dados para outro. Analisar requerimentos dos usuários. Pesquisar, desenhar e desenvolver novos programas de software. Testar novos programas e procurar por falhas. Experiência (quando aplicável no projeto) em Cloud (AWS, Azure, IBM) - provisionamento de ambiente, conectividade, desenvolvimento e consumo de APIs. Experiência comprovada em Engenharia de dados. Experiência e/ou conhecimento com as seguintes tecnologias: Hadoop, MapReduce, Spark, HBase, Hive, Teradata, Kafka. Preferencialmente com familiaridade nas distribuições Horton / Cloudera. Proficiência em Linux incluindo construção de shell script. Experiência na arquitetura da plataforma SAS, Teradata, Greenplum e ecossistema Hadoop. Conhecimento e experiência avançada com SQL. Conhecimento e experiência com produtos e serviços das áreas de negócios de instituições financeiras.
Engenheiro de Dados Sênior;https://www.catho.com.br/vagas/engenheiro-de-dados-senior/18578338/?origem_apply=busca-de-vagas&entrada_apply=direto;São Paulo - SP (1);Atuar como Engenheiro de Dados Generalista em atividades relacionadas à ciência de dados e data analytics. Colaborador com o desenvolvimento do processo para adequações ao LGPD. Atuar na construção de um sistema robusto. Trabalhar na atualização constante de melhores práticas com relação a segurança da informação. Ser alguém que deseja ser protagonistas de sua carreira e que tenha vontade de gerar impactos e transformações positivas em seu redor Conhecimento na língua inglesa. Atuamos em times e projetos globais, por isso este conhecimento é fundamental em seu dia a dia Graduação completa em Engenharias, Ciências da Computação, Matemática e áreas correlatas. Experiência em BI / Big Data, modelagem de dados, construção de pipelines usando sistemas distribuídos, como Hadoop e/ou Spark Experiência no processo de Mineração de Dados. Experiência prática com ingestão, integração, processamento e armazenamento de grandes volumes de dados. Conhecimento na Lei de Proteção à Dados (LGPD). Conhecimento Programação em linguagens como: Python, R, Scala ou Java Experiência com bancos de dados relacionais como: SQL Server, Oracle e MySQL. Experiência com bancos de dados NoSQL. Experiência na utilização dos conceitos de classificação e previsão de dados para construção de modelos de machine learning. Experiência no processo de preparação de dados. Limpeza, Enriquecimento, codificação e feature engineering. Conhecimento em engenharia de atributos.
Engenheiro de Dados - Oncologia;https://www.catho.com.br/vagas/engenheiro-de-dados-oncologia/18479047/?origem_apply=busca-de-vagas&entrada_apply=direto;São Paulo - SP (1);Quais serão suas principais atividades? Desenvolver e cuidar do Data Lake, do funcionamento e do correto uso dos dados da Oncologia por parte de outras áreas Desenvolver rotinas ETL Construir integrações com novas APIs e sistemas de mensageria que deem suporte ao crescimento contínuo em volume e complexidade de dados Implementar processos e sistemas para monitorar a qualidade dos dados, garantindo que as informações disponíveis para tomadas de decisão estejam acuradas com os dados de produção Desenvolver e manter datawarehouses modernos e datamarts da companhia, possibilitando a tomada de decisão de diversas áreas de negócio Trabalhar próximo aos demais engenheiros de backend , cientistas de dados, analistas de dados, product owners e analistas de qualidade Implantar programas analíticos sofisticados, Machine Learning e métodos estatísticos Preparar dados para modelagem preditiva e prescritiva Encontrar padrões ocultos usando dados. O que você precisa para se inscrever? Superior Completo em Ciências da Computação, Engenharia da Computação, Sistemas de Informação, Análise e Desenvolvimento de Sistemas ou áreas correlatas) Experiência com ferramentas de processamento de dados distribuídos (Hadoop, Hive, Spark, Flink, Beam, Storm, Samza) e em prototipação e desenvolvimento de ETL Conhecimento de ferramentas Cloud (AWS e/ou GCP), Linux e em desenvolvimentos de APIs Rest Experiência com banco de dados relacionais e não relacionais (NoSQL) Prática em linguagem Python, Scala ou Java Conhecimento avançado em SQL Experiência de trabalho em times ágeis utilizando metodologia Scrum ou Kanb. O que oferecemos? Ticket Refeição. Ticket Alimentação. Plano de Saúde (após os 90 dias de experiência). Plano Odontológico (após os 90 dias de experiência). PLR. Além dos benefícios citados acima, temos descontos em estabelecimentos credenciados, auxílio educacional, programas de qualidade de vida e um programa de apoio psicológico, financeiro, jurídico e social. Você trabalhará na unidade Corporativa, na Avenida Paulista, de segunda à sexta-feira em horário comercial.
Engenheiro de Dados Sênior;https://www.catho.com.br/vagas/engenheiro-de-dados-senior/18625795/?origem_apply=busca-de-vagas&entrada_apply=direto;São Paulo - SP (1);A empresa multinacional especializada em Management Consulting, Business Intelligence, Big Data, Web Performance, e-Commerce, Omni Channel e soluções ERP-CRM. Desenvolvimento técnico das tarefas combinadas usando as tecnologias propostas. Capacidade de análise de soluções apropriadas e criá-las tecnicamente, com a qualidade apropriada (testes em QA, criação de massas de testes, etc).  Participação ativa nos ritos do Scrum como integrante do time, como daily meetings, plannings (poker), apresentação de resultados em review. Perfil desejado: Shellscript. Python. Tecnologias hadoop (hive, phoenix, spark, yarn e seus conceitos inerentes à computação em cluster). Criação de queries analíticas em SQL/Spark SQL. Conhecimentos de programação funcional usando Scala. Ótimos conhecimentos de GCP "nativo" (cloud functions, dataproc, cloud build, etc..). Perfil comportamental: Trabalho em equipe, boa comunicação, boa organização, comprometimento e pró-atividade,
Engenheiro (a) de Dados (SAP);https://www.catho.com.br/vagas/engenheiro-a-de-dados-sap/18605989/?origem_apply=busca-de-vagas&entrada_apply=direto;São Paulo - SP (1);Experiência e bons conhecimentos em Data Factory  Experiência e bons conhecimentos em Data Lake Storage  Experiência em desenvolvimento e modelagem de Data Warehouse  Experiência com Origens de dados SAP Data Services, SAP Hana, SAP ECC, SAP BW  Azure. Requerido  Experiência e bons conhecimentos em Data Factory  Experiência e bons conhecimentos em Data Lake Storage  Experiência em desenvolvimento e modelagem de Data Warehouse  Experiência com Origens de dados SAP Data Services, SAP Hana, SAP ECC, SAP BW  Azure.
